{
  "$schema": "https://json-schema.org/draft/2020-12/schema",
  "title": "Doe run receipt",
  "type": "object",
  "additionalProperties": false,
  "required": [
    "schemaVersion",
    "artifactKind",
    "generatedAt",
    "product",
    "executorId",
    "invocation",
    "workloadManifest",
    "workload",
    "normalization",
    "runtimeIdentity",
    "hostIdentity",
    "execution",
    "samples"
  ],
  "properties": {
    "schemaVersion": {
      "type": "integer",
      "const": 1
    },
    "artifactKind": {
      "type": "string",
      "const": "run-receipt"
    },
    "generatedAt": {
      "type": "string",
      "format": "date-time"
    },
    "product": {
      "type": "string",
      "minLength": 1
    },
    "executorId": {
      "type": "string",
      "minLength": 1
    },
    "invocation": {
      "type": "object",
      "additionalProperties": false,
      "required": [
        "command",
        "iterations",
        "warmup",
        "resourceProbe",
        "resourceSampleMs",
        "resourceSampleTargetCount"
      ],
      "properties": {
        "command": {
          "type": "array",
          "items": {
            "type": "string"
          }
        },
        "iterations": {
          "type": "integer",
          "minimum": 1
        },
        "warmup": {
          "type": "integer",
          "minimum": 0
        },
        "resourceProbe": {
          "type": "string"
        },
        "resourceSampleMs": {
          "type": "integer",
          "minimum": 0
        },
        "resourceSampleTargetCount": {
          "type": "integer",
          "minimum": 0
        }
      }
    },
    "workloadManifest": {
      "$ref": "#/$defs/workloadManifest"
    },
    "workload": {
      "type": "object",
      "additionalProperties": false,
      "required": [
        "id",
        "name",
        "description",
        "domain",
        "commandsPath",
        "quirksPath",
        "planPath",
        "vendor",
        "api",
        "family",
        "driver",
        "comparable",
        "benchmarkClass",
        "comparabilityNotes",
        "directionalReason",
        "pathAsymmetry",
        "pathAsymmetryNote",
        "claimEligible",
        "strictNormalizationUnit"
      ],
      "properties": {
        "id": {
          "type": "string",
          "minLength": 1
        },
        "name": {
          "type": "string"
        },
        "description": {
          "type": "string"
        },
        "domain": {
          "type": "string",
          "minLength": 1
        },
        "commandsPath": {
          "type": "string"
        },
        "quirksPath": {
          "type": "string"
        },
        "planPath": {
          "type": "string"
        },
        "vendor": {
          "type": "string"
        },
        "api": {
          "type": "string"
        },
        "family": {
          "type": "string"
        },
        "driver": {
          "type": "string"
        },
        "comparable": {
          "type": "boolean"
        },
        "benchmarkClass": {
          "type": "string"
        },
        "comparabilityNotes": {
          "type": "string"
        },
        "directionalReason": {
          "type": "string"
        },
        "pathAsymmetry": {
          "type": "boolean"
        },
        "pathAsymmetryNote": {
          "type": "string"
        },
        "claimEligible": {
          "type": "boolean"
        },
        "strictNormalizationUnit": {
          "type": "string"
        }
      }
    },
    "normalization": {
      "type": "object",
      "additionalProperties": false,
      "required": [
        "commandRepeat",
        "ignoreFirstOps",
        "timingDivisor",
        "uploadBufferUsage",
        "uploadSubmitEvery",
        "timingNormalizationNote",
        "allowNoExecution"
      ],
      "properties": {
        "commandRepeat": {
          "type": "integer",
          "minimum": 1
        },
        "ignoreFirstOps": {
          "type": "integer",
          "minimum": 0
        },
        "timingDivisor": {
          "type": "number",
          "exclusiveMinimum": 0
        },
        "uploadBufferUsage": {
          "type": "string"
        },
        "uploadSubmitEvery": {
          "type": "integer",
          "minimum": 1
        },
        "timingNormalizationNote": {
          "type": "string"
        },
        "allowNoExecution": {
          "type": "boolean"
        }
      }
    },
    "runtimeIdentity": {
      "type": "object",
      "additionalProperties": false,
      "required": [
        "runtimeHost",
        "binaryPath",
        "binarySha256",
        "executionBackend",
        "providerId",
        "providerName",
        "packageName",
        "packageVersion",
        "packageLockHash"
      ],
      "properties": {
        "runtimeHost": {
          "type": "string"
        },
        "binaryPath": {
          "type": "string"
        },
        "binarySha256": {
          "type": "string"
        },
        "executionBackend": {
          "type": "string"
        },
        "providerId": {
          "type": "string"
        },
        "providerName": {
          "type": "string"
        },
        "packageName": {
          "type": "string"
        },
        "packageVersion": {
          "type": "string"
        },
        "packageLockHash": {
          "type": "string"
        },
        "nativeDelegate": {
          "type": "object",
          "additionalProperties": false,
          "required": [
            "kind",
            "libraryPath",
            "librarySha256"
          ],
          "properties": {
            "kind": {
              "type": "string"
            },
            "libraryPath": {
              "type": "string",
              "minLength": 1
            },
            "librarySha256": {
              "type": "string",
              "pattern": "^[0-9a-f]{64}$"
            }
          }
        },
        "pipelineCache": {
          "type": "object",
          "additionalProperties": false,
          "required": [
            "state",
            "reason",
            "warmupCount",
            "warmupNs"
          ],
          "properties": {
            "backend": {
              "type": "string",
              "enum": ["metal", "vulkan", "d3d12"]
            },
            "state": {
              "type": "string",
              "enum": ["enabled", "disabled", "unknown"]
            },
            "reason": {
              "type": "string",
              "enum": ["default", "cli-flag", "non-doe-backend", "platform-unsupported", "unknown"]
            },
            "warmupCount": {
              "type": "integer",
              "minimum": 0
            },
            "warmupNs": {
              "type": "integer",
              "minimum": 0
            },
            "flushNs": {
              "type": "integer",
              "minimum": 0
            }
          }
        }
      }
    },
    "hostIdentity": {
      "type": "object",
      "additionalProperties": false,
      "required": [
        "hostname",
        "os",
        "kernel",
        "arch",
        "api",
        "driver",
        "adapter"
      ],
      "properties": {
        "hostname": {
          "type": "string"
        },
        "os": {
          "type": "string"
        },
        "kernel": {
          "type": "string"
        },
        "arch": {
          "type": "string"
        },
        "api": {
          "type": "string"
        },
        "driver": {
          "type": "string"
        },
        "adapter": {
          "type": "object",
          "additionalProperties": false,
          "required": [
            "vendor",
            "device",
            "architecture",
            "description"
          ],
          "properties": {
            "vendor": {
              "type": "string"
            },
            "device": {
              "type": "string"
            },
            "architecture": {
              "type": "string"
            },
            "description": {
              "type": "string"
            },
            "vendorID": {
              "type": "integer",
              "minimum": 0
            },
            "deviceID": {
              "type": "integer",
              "minimum": 0
            },
            "driverVersion": {
              "type": "integer",
              "minimum": 0
            }
          }
        }
      }
    },
    "execution": {
      "type": "object",
      "additionalProperties": false,
      "required": [
        "success",
        "timedSampleCount",
        "returnCodes",
        "timingSources",
        "timingClasses",
        "aggregates"
      ],
      "properties": {
        "success": {
          "type": "boolean",
          "description": "True only when every recorded sample is successful timed execution evidence."
        },
        "timedSampleCount": {
          "type": "integer",
          "minimum": 0,
          "description": "Count of samples with returnCode=0 and non-null measuredMs. Command-only receipts emitted by --emit-shell must report 0."
        },
        "returnCodes": {
          "type": "array",
          "description": "Observed sample return codes. Command-only samples that were not executed use a non-zero return code and success=false.",
          "items": {
            "type": "integer"
          }
        },
        "timingSources": {
          "type": "array",
          "items": {
            "type": "string"
          }
        },
        "timingClasses": {
          "type": "array",
          "items": {
            "type": "string"
          }
        },
        "aggregates": {
          "type": "object",
          "additionalProperties": false,
          "required": [
            "wallMs",
            "measuredMs",
            "measuredRawMs"
          ],
          "properties": {
            "wallMs": {
              "$ref": "#/$defs/sampleStats"
            },
            "measuredMs": {
              "$ref": "#/$defs/sampleStats"
            },
            "measuredRawMs": {
              "$ref": "#/$defs/sampleStats"
            }
          }
        }
      }
    },
    "samples": {
      "type": "array",
      "items": {
        "$ref": "#/$defs/sample"
      }
    }
  },
  "$defs": {
    "workloadManifest": {
      "type": "object",
      "additionalProperties": false,
      "required": [
        "path",
        "sha256",
        "ownership",
        "inputFreshness",
        "freshnessReason"
      ],
      "properties": {
        "path": {
          "type": "string"
        },
        "sha256": {
          "type": "string"
        },
        "ownership": {
          "type": "string",
          "enum": [
            "standalone",
            "generated"
          ]
        },
        "inputFreshness": {
          "type": "string",
          "enum": [
            "fresh",
            "stale",
            "unknown"
          ]
        },
        "freshnessReason": {
          "type": "string"
        },
        "generatorId": {
          "type": "string"
        },
        "generatorInputHash": {
          "type": "string"
        },
        "generatedAt": {
          "type": "string"
        }
      }
    },
    "nullableNumber": {
      "type": [
        "number",
        "null"
      ]
    },
    "sampleStats": {
      "type": "object",
      "additionalProperties": false,
      "required": [
        "count",
        "minMs",
        "maxMs",
        "p10Ms",
        "p50Ms",
        "p95Ms",
        "p99Ms",
        "meanMs",
        "stdevMs"
      ],
      "properties": {
        "count": {
          "type": "integer",
          "minimum": 0
        },
        "minMs": {
          "type": "number"
        },
        "maxMs": {
          "type": "number"
        },
        "p10Ms": {
          "type": "number"
        },
        "p50Ms": {
          "type": "number"
        },
        "p95Ms": {
          "type": "number"
        },
        "p99Ms": {
          "type": "number"
        },
        "meanMs": {
          "type": "number"
        },
        "stdevMs": {
          "type": "number"
        }
      }
    },
    "sample": {
      "type": "object",
      "additionalProperties": false,
      "required": [
        "runIndex",
        "command",
        "wallMs",
        "measuredRawMs",
        "measuredMs",
        "timingSource",
        "timingClass",
        "traceArtifacts",
        "subphasesMs",
        "resource",
        "returnCode",
        "success",
        "traceMeta"
      ],
      "properties": {
        "runIndex": {
          "type": "integer",
          "minimum": 0
        },
        "command": {
          "type": "array",
          "items": {
            "type": "string"
          }
        },
        "wallMs": {
          "$ref": "#/$defs/nullableNumber"
        },
        "measuredRawMs": {
          "$ref": "#/$defs/nullableNumber"
        },
        "measuredMs": {
          "$ref": "#/$defs/nullableNumber"
        },
        "timingSource": {
          "type": "string"
        },
        "timingClass": {
          "type": "string"
        },
        "timing": {
          "type": "object"
        },
        "traceArtifacts": {
          "type": "object",
          "additionalProperties": false,
          "required": [
            "jsonlPath",
            "metaPath"
          ],
          "properties": {
            "jsonlPath": {
              "type": "string"
            },
            "metaPath": {
              "type": "string"
            }
          }
        },
        "subphasesMs": {
          "type": "object",
          "additionalProperties": false,
          "required": [
            "executionMs",
            "setupMs",
            "encodeMs",
            "submitWaitMs",
            "gpuTimestampMs"
          ],
          "properties": {
            "executionMs": {
              "$ref": "#/$defs/nullableNumber"
            },
            "setupMs": {
              "$ref": "#/$defs/nullableNumber"
            },
            "encodeMs": {
              "$ref": "#/$defs/nullableNumber"
            },
            "submitWaitMs": {
              "$ref": "#/$defs/nullableNumber"
            },
            "gpuTimestampMs": {
              "$ref": "#/$defs/nullableNumber"
            }
          }
        },
        "resource": {
          "type": "object"
        },
        "commandRepeat": {
          "type": "integer",
          "minimum": 1
        },
        "uploadIgnoreFirstOps": {
          "type": "integer",
          "minimum": 0
        },
        "uploadBufferUsage": {
          "type": "string"
        },
        "uploadSubmitEvery": {
          "type": "integer",
          "minimum": 1
        },
        "timingNormalizationDivisor": {
          "type": "number",
          "exclusiveMinimum": 0
        },
        "workloadUnitNormalizationDivisor": {
          "type": "number",
          "exclusiveMinimum": 0
        },
        "workloadDomain": {
          "type": "string"
        },
        "strictNormalizationUnit": {
          "type": "string"
        },
        "returnCode": {
          "type": "integer",
          "description": "Subprocess or sample return code. A missing execution result is encoded as non-zero so command-only rows cannot pass as successful execution."
        },
        "success": {
          "type": "boolean",
          "description": "True only for executed samples with returnCode=0."
        },
        "traceMeta": {
          "type": "object"
        }
      }
    }
  }
}
