{
  "artifactKind": "run-receipt",
  "execution": {
    "aggregates": {
      "measuredMs": {
        "count": 16,
        "maxMs": 225.577689,
        "meanMs": 224.052782625,
        "minMs": 222.758183,
        "p10Ms": 223.222436,
        "p50Ms": 223.736386,
        "p95Ms": 224.941254,
        "p99Ms": 224.941254,
        "stdevMs": 0.7350990424602524
      },
      "measuredRawMs": {
        "count": 16,
        "maxMs": 225.577689,
        "meanMs": 224.052782625,
        "minMs": 222.758183,
        "p10Ms": 223.222436,
        "p50Ms": 223.736386,
        "p95Ms": 224.941254,
        "p99Ms": 224.941254,
        "stdevMs": 0.7350990424602524
      },
      "wallMs": {
        "count": 16,
        "maxMs": 301.5508269891143,
        "meanMs": 301.24135198275326,
        "minMs": 300.95278995577246,
        "p10Ms": 301.0775400325656,
        "p50Ms": 301.26434296835214,
        "p95Ms": 301.36432696599513,
        "p99Ms": 301.36432696599513,
        "stdevMs": 0.1355738375090157
      }
    },
    "returnCodes": [
      0
    ],
    "success": true,
    "timedSampleCount": 16,
    "timingClasses": [
      "operation"
    ],
    "timingSources": [
      "doe-execution-total-ns"
    ]
  },
  "executorId": "doe",
  "generatedAt": "2026-07-02T16:32:21.300333+00:00",
  "hostIdentity": {
    "adapter": {
      "architecture": "",
      "description": "",
      "device": "",
      "vendor": "amd"
    },
    "api": "vulkan",
    "arch": "x86_64",
    "driver": "24.0.0",
    "hostname": "128",
    "kernel": "7.0.0-22-generic",
    "os": "linux"
  },
  "invocation": {
    "command": [
      "env",
      "LD_LIBRARY_PATH=bench/vendor/dawn/out/Release:$LD_LIBRARY_PATH",
      "runtime/zig/zig-out/bin/doe-zig-runtime",
      "--commands",
      "examples/matrix_vector_mul_32768x2048_swizzle1_commands.json",
      "--quirks",
      "examples/quirks/amd_radv_noop_list.json",
      "--vendor",
      "amd",
      "--api",
      "vulkan",
      "--family",
      "gfx11",
      "--driver",
      "24.0.0",
      "--backend",
      "native",
      "--backend-lane",
      "vulkan_doe_release",
      "--execute",
      "--pipeline-cache-dir",
      "bench/out/pipeline-cache/amd-vulkan-release",
      "--queue-sync-mode",
      "per-command",
      "--webgpu-ffi-queue-wait-timeout-ns",
      "10000000000",
      "--upload-buffer-usage",
      "copy-dst-copy-src",
      "--upload-submit-every",
      "1",
      "--trace-jsonl",
      "bench/out/amd-vulkan/20260702T163200Z/runtime-comparisons.amd.vulkan.release/isolated-runs/doe/compute_matvec_32768x2048_f32_swizzle1/doe.run001.ndjson",
      "--trace-meta",
      "bench/out/amd-vulkan/20260702T163200Z/runtime-comparisons.amd.vulkan.release/isolated-runs/doe/compute_matvec_32768x2048_f32_swizzle1/doe.run001.meta.json",
      "--kernel-root",
      "bench/kernels",
      "--kernel-root",
      "bench/kernels"
    ],
    "iterations": 16,
    "resourceProbe": "none",
    "resourceSampleMs": 100,
    "resourceSampleTargetCount": 0,
    "warmup": 1
  },
  "normalization": {
    "allowNoExecution": false,
    "commandRepeat": 1,
    "ignoreFirstOps": 0,
    "timingDivisor": 1.0,
    "timingNormalizationNote": "Strict Dawn-vs-Doe operation comparability uses direct timing (baseline/comparison divisors fixed to 1.0).",
    "uploadBufferUsage": "copy-dst-copy-src",
    "uploadSubmitEvery": 1
  },
  "product": "doe",
  "runtimeIdentity": {
    "binaryPath": "runtime/zig/zig-out/bin/doe-zig-runtime",
    "binarySha256": "fdef3b47a9b3f4f75ecb1587e9053e587be290e1035381ce5e9d38207aec3d62",
    "executionBackend": "doe_vulkan",
    "packageLockHash": "",
    "packageName": "",
    "packageVersion": "",
    "pipelineCache": {
      "reason": "default",
      "state": "enabled",
      "warmupCount": 1,
      "warmupNs": 141065
    },
    "providerId": "",
    "providerName": "",
    "runtimeHost": "native"
  },
  "samples": [
    {
      "command": [
        "env",
        "LD_LIBRARY_PATH=bench/vendor/dawn/out/Release:$LD_LIBRARY_PATH",
        "runtime/zig/zig-out/bin/doe-zig-runtime",
        "--commands",
        "examples/matrix_vector_mul_32768x2048_swizzle1_commands.json",
        "--quirks",
        "examples/quirks/amd_radv_noop_list.json",
        "--vendor",
        "amd",
        "--api",
        "vulkan",
        "--family",
        "gfx11",
        "--driver",
        "24.0.0",
        "--backend",
        "native",
        "--backend-lane",
        "vulkan_doe_release",
        "--execute",
        "--pipeline-cache-dir",
        "bench/out/pipeline-cache/amd-vulkan-release",
        "--queue-sync-mode",
        "per-command",
        "--webgpu-ffi-queue-wait-timeout-ns",
        "10000000000",
        "--upload-buffer-usage",
        "copy-dst-copy-src",
        "--upload-submit-every",
        "1",
        "--trace-jsonl",
        "bench/out/amd-vulkan/20260702T163200Z/runtime-comparisons.amd.vulkan.release/isolated-runs/doe/compute_matvec_32768x2048_f32_swizzle1/doe.run001.ndjson",
        "--trace-meta",
        "bench/out/amd-vulkan/20260702T163200Z/runtime-comparisons.amd.vulkan.release/isolated-runs/doe/compute_matvec_32768x2048_f32_swizzle1/doe.run001.meta.json",
        "--kernel-root",
        "bench/kernels",
        "--kernel-root",
        "bench/kernels"
      ],
      "commandRepeat": 1,
      "measuredMs": 223.602545,
      "measuredRawMs": 223.602545,
      "resource": {
        "gpuMemoryProbe": "none",
        "gpuMemoryProbeAvailable": false,
        "processCpuMs": 52.15199999999997,
        "processPeakRssKb": 74620,
        "processWallMs": 301.3314160052687,
        "resourceSampleCount": 4,
        "resourceSampleMs": 100,
        "resourceSampleTargetCount": 0,
        "resourceSamplingTruncated": false
      },
      "returnCode": 0,
      "runIndex": 1,
      "strictNormalizationUnit": "",
      "subphasesMs": {
        "encodeMs": 0.060604,
        "executionMs": 223.602545,
        "gpuTimestampMs": null,
        "setupMs": 0.008796,
        "submitWaitMs": 223.32841
      },
      "success": true,
      "timing": {
        "commandRepeat": 1,
        "executionDispatchCount": 100,
        "executionRowCount": 1,
        "executionSuccessCount": 1,
        "executionTotalNs": 223602545,
        "hostKernelPrewarmScope": "outside-selected-execution-timing",
        "hostKernelPrewarmTotalNs": 39502969,
        "repeatNormalized": false,
        "source": "trace-meta",
        "timingConfiguredDivisor": 1.0,
        "timingNormalizationDivisor": 1.0,
        "timingNormalizedMs": 223.602545,
        "timingRawMs": 223.602545,
        "traceMetaSource": "doe-execution-total-ns",
        "traceMetaTimingMs": 223.602545,
        "uploadBufferUsage": "copy-dst-copy-src",
        "uploadSubmitEvery": 1,
        "wallTimeMs": 301.3314160052687,
        "workloadUnitNormalizationDivisor": 100.0,
        "workloadUnitNormalizationSource": "trace-counter-derived"
      },
      "timingClass": "operation",
      "timingNormalizationDivisor": 1.0,
      "timingSource": "doe-execution-total-ns",
      "traceArtifacts": {
        "jsonlPath": "bench/out/amd-vulkan/20260702T163200Z/runtime-comparisons.amd.vulkan.release/isolated-runs/doe/compute_matvec_32768x2048_f32_swizzle1/doe.run001.ndjson",
        "metaPath": "bench/out/amd-vulkan/20260702T163200Z/runtime-comparisons.amd.vulkan.release/isolated-runs/doe/compute_matvec_32768x2048_f32_swizzle1/doe.run001.meta.json"
      },
      "traceMeta": {
        "adapterOrdinal": 0,
        "backendId": "doe_vulkan",
        "backendLane": "vulkan_doe_release",
        "backendSelectionReason": "policy_lane_prefers_doe_vulkan",
        "blockingCount": 0,
        "commandCount": 1,
        "executionBackend": "doe_vulkan",
        "executionDispatchCount": 100,
        "executionEncodeTotalNs": 60604,
        "executionErrorCount": 0,
        "executionGpuTimestampAttemptedCount": 1,
        "executionGpuTimestampTotalNs": 222786537,
        "executionGpuTimestampValidCount": 1,
        "executionRowCount": 1,
        "executionSetupTotalNs": 8796,
        "executionSkippedCount": 0,
        "executionSubmitCount": 1,
        "executionSubmitWaitTotalNs": 223328410,
        "executionSuccessCount": 1,
        "executionTotalNs": 223602545,
        "executionUnsupportedCount": 0,
        "fallbackUsed": false,
        "hash": "0x4a5f384232278248",
        "hostArtifactFinalizeTotalNs": 213561,
        "hostArtifactOperatorManifestFinalizeTotalNs": 15109,
        "hostArtifactTraceJsonlSerializeTotalNs": 101540,
        "hostArtifactTraceJsonlWriteTotalNs": 31990,
        "hostCommandOrchestrationTotalNs": 807095,
        "hostExecutorInitTotalNs": 867649,
        "hostInputParseTotalNs": 685619,
        "hostInputReadTotalNs": 49282,
        "hostKernelPrewarmTotalNs": 39502969,
        "hostUploadPrewarmTotalNs": 0,
        "hostWorkloadPrepareTotalNs": 14638,
        "leanRequiredCount": 0,
        "matchedCount": 0,
        "module": "doe-zig-runtime",
        "pipelineCache": {
          "reason": "default",
          "state": "enabled",
          "warmupCount": 1,
          "warmupNs": 141065
        },
        "presentCapable": true,
        "previousHash": "0x9e3779b97f4a7c15",
        "profile": {
          "api": "vulkan",
          "deviceFamily": "gfx11",
          "driver": "24.0.0",
          "vendor": "amd"
        },
        "queueFamilyIndex": 0,
        "queueFamilyKind": "graphics_compute",
        "queueFamilyPolicy": "prefer_graphics_compute",
        "queueFamilyQueueCount": 1,
        "queueFamilySupportsGraphics": true,
        "queueFamilyTimestampValidBits": 64,
        "queueSyncMode": "per-command",
        "queueWaitMode": "process-events",
        "quirkMode": "trace",
        "requiresLeanCount": 0,
        "rowCount": 1,
        "selectionPolicyHash": "backend-runtime-policy-v5",
        "semanticCaptureCount": 0,
        "semanticOpRowCount": 0,
        "semanticReproCount": 0,